{"$schema":"https://json-schema.org/draft/2020-12/schema","$id":"https://ev4.local/schemas/stage-bundle/stage-bundle.v1.schema.json","title":"EV4 Stage Evidence Bundle v1","type":"object","additionalProperties":false,"required":["schema_version","bundle_id","stage","payload_schema","produced_by","evidence_status","payload","evidence","provenance","synthetic"],"properties":{"schema_version":{"const":"stage-evidence-bundle.v1"},"bundle_id":{"type":"string","minLength":1},"stage":{"type":"string","enum":["architect","ce","builder","responsive"]},"payload_schema":{"type":"object","additionalProperties":false,"required":["id","version","owner_repository"],"properties":{"id":{"type":"string","minLength":1},"version":{"type":"string","minLength":1},"owner_repository":{"type":"string","pattern":"^[A-Za-z0-9_.-]+/[A-Za-z0-9_.-]+$"}}},"produced_by":{"type":"object","additionalProperties":false,"required":["repository","ref"],"properties":{"repository":{"type":"string","pattern":"^[A-Za-z0-9_.-]+/[A-Za-z0-9_.-]+$"},"ref":{"type":"string","minLength":1},"commit_sha":{"type":"string","pattern":"^[a-f0-9]{40}$"},"workflow_run_id":{"type":"string","minLength":1}}},"evidence_status":{"type":"string","enum":["complete","insufficient_evidence"]},"missing_evidence":{"type":"array","minItems":1,"items":{"$ref":"#/$defs/missingEvidence"}},"payload":{"type":"object","additionalProperties":false,"required":["schema_id","data"],"properties":{"schema_id":{"type":"string","minLength":1},"data":{"type":"object","description":"Stage-owned payload extension point. Project Gate validates the envelope only in this PR.","additionalProperties":true}}},"evidence":{"type":"array","minItems":1,"items":{"$ref":"#/$defs/evidenceItem"}},"provenance":{"type":"object","additionalProperties":false,"required":["source","created_by"],"properties":{"source":{"type":"string","minLength":1},"created_by":{"type":"string","minLength":1},"created_at":{"type":"string","pattern":"^\\d{4}-\\d{2}-\\d{2}T\\d{2}:\\d{2}:\\d{2}Z$"}}},"synthetic":{"type":"boolean"}},"allOf":[{"if":{"properties":{"evidence_status":{"const":"insufficient_evidence"}},"required":["evidence_status"]},"then":{"required":["missing_evidence"]}},{"if":{"properties":{"evidence_status":{"const":"complete"}},"required":["evidence_status"]},"then":{"not":{"required":["missing_evidence"]}}}],"$defs":{"hashRecord":{"type":"object","additionalProperties":false,"required":["algorithm","value","scope"],"properties":{"algorithm":{"const":"sha256"},"value":{"type":"string","pattern":"^[a-f0-9]{64}$"},"scope":{"type":"string","enum":["canonical_json","file_bytes","external_artifact"]}}},"evidenceItem":{"type":"object","additionalProperties":false,"required":["id","kind","state","description","artifact_hash","source"],"properties":{"id":{"type":"string","minLength":1},"kind":{"type":"string","enum":["document","schema","fixture","validator","screenshot","report","other"]},"state":{"type":"string","enum":["observed","exported","validated","resolved","derived","proposed","unverified","insufficient_evidence"]},"description":{"type":"string","minLength":1},"artifact_hash":{"$ref":"#/$defs/hashRecord"},"source":{"type":"object","additionalProperties":false,"required":["type","reference"],"properties":{"type":{"type":"string","enum":["repo_path","workflow","manual_observation","synthetic_fixture"]},"reference":{"type":"string","minLength":1}}},"derivation_rule":{"type":"object","additionalProperties":false,"required":["id","version"],"properties":{"id":{"type":"string","minLength":1},"version":{"type":"string","minLength":1}}}}},"missingEvidence":{"type":"object","additionalProperties":false,"required":["id","owner","reason"],"properties":{"id":{"type":"string","minLength":1},"owner":{"type":"string","minLength":1},"reason":{"type":"string","minLength":1}}}}}
